{
  "$schema": "https://json-schema.org/draft/2020-12/schema",
  "$id": "https://wordmuster.dev/schemas/challenge/challengeSettings.schema.json",
  "title": "Challenge Settings Schema",
  "type": "object",
  "additionalProperties": false,
  "required": [
    "dataVersion",
    "generatedOn",
    "sourceLexiconVersion",
    "language",
    "difficultyBands",
    "timers",
    "scoring",
    "hints"
  ],
  "properties": {
    "dataVersion": {
      "type": "string",
      "minLength": 1
    },
    "generatedOn": {
      "type": "string",
      "format": "date-time"
    },
    "sourceLexiconVersion": {
      "type": "string",
      "minLength": 1
    },
    "language": {
      "type": "string",
      "enum": ["EN"]
    },
    "difficultyBands": {
      "type": "array",
      "minItems": 1,
      "items": {
        "type": "object",
        "additionalProperties": false,
        "required": [
          "id",
          "displayName",
          "gradeHint",
          "rackLetterCount",
          "allowLetterReuseByTimer"
        ],
        "properties": {
          "id": {
            "type": "string",
            "enum": ["EASY", "MEDIUM", "HARD", "PRO"]
          },
          "displayName": {
            "type": "string",
            "minLength": 1
          },
          "gradeHint": {
            "type": "string",
            "minLength": 1
          },
          "rackLetterCount": {
            "type": "integer",
            "enum": [7, 8, 10, 12]
          },
          "allowLetterReuseByTimer": {
            "type": "object",
            "additionalProperties": false,
            "required": ["30", "60", "90"],
            "properties": {
              "30": { "type": "boolean" },
              "60": { "type": "boolean" },
              "90": { "type": "boolean" }
            }
          }
        }
      }
    },
    "timers": {
      "type": "array",
      "minItems": 1,
      "uniqueItems": true,
      "items": {
        "type": "integer",
        "enum": [30, 60, 90]
      }
    },
    "scoring": {
      "type": "object",
      "additionalProperties": false,
      "required": [
        "completionPercentMode",
        "altCompletionPercentMode",
        "rawScoreEnabled",
        "rawScore",
        "stars",
        "completionModes"
      ],
      "properties": {
        "completionPercentMode": {
          "type": "string",
          "enum": ["FOUND_OVER_TOTAL_POSSIBLE", "FOUND_OVER_TARGET"]
        },
        "altCompletionPercentMode": {
          "type": "string",
          "enum": ["FOUND_OVER_TOTAL_POSSIBLE", "FOUND_OVER_TARGET"]
        },
        "rawScoreEnabled": {
          "type": "boolean"
        },
        "rawScore": {
          "type": "object",
          "additionalProperties": false,
          "required": [
            "basePerWord",
            "lengthBonus",
            "perfectRoundBonus"
          ],
          "properties": {
            "basePerWord": {
              "type": "integer",
              "minimum": 0
            },
            "lengthBonus": {
              "type": "object",
              "additionalProperties": false,
              "required": ["3", "4", "5", "6", "7", "8", "9", "10", "11", "12"],
              "properties": {
                "3": { "type": "integer" },
                "4": { "type": "integer" },
                "5": { "type": "integer" },
                "6": { "type": "integer" },
                "7": { "type": "integer" },
                "8": { "type": "integer" },
                "9": { "type": "integer" },
                "10": { "type": "integer" },
                "11": { "type": "integer" },
                "12": { "type": "integer" }
              }
            },
            "perfectRoundBonus": {
              "type": "object",
              "additionalProperties": false,
              "required": ["type", "value"],
              "properties": {
                "type": {
                  "type": "string",
                  "enum": ["PERCENT", "FLAT"]
                },
                "value": {
                  "type": "integer",
                  "minimum": 0
                }
              }
            }
          }
        },
        "stars": {
          "type": "object",
          "additionalProperties": false,
          "required": [
            "star1Percent",
            "star2Percent",
            "star3Percent"
          ],
          "properties": {
            "star1Percent": {
              "type": "integer",
              "minimum": 0,
              "maximum": 100
            },
            "star2Percent": {
              "type": "integer",
              "minimum": 0,
              "maximum": 100
            },
            "star3Percent": {
              "type": "integer",
              "minimum": 0,
              "maximum": 100
            }
          }
        },
        "completionModes": {
          "type": "array",
          "minItems": 1,
          "items": {
            "type": "object",
            "additionalProperties": false,
            "required": [
              "id",
              "label",
              "numerator",
              "denominator",
              "csvField"
            ],
            "properties": {
              "id": {
                "type": "string",
                "minLength": 1
              },
              "label": {
                "type": "string",
                "minLength": 1
              },
              "numerator": {
                "type": "string",
                "minLength": 1
              },
              "denominator": {
                "type": "string",
                "minLength": 1
              },
              "csvField": {
                "type": "string",
                "minLength": 1
              },
              "optional": {
                "type": "boolean"
              }
            }
          }
        }
      }
    },
    "hints": {
      "type": "object",
      "additionalProperties": false,
      "required": [
        "maxHintsPerRound",
        "coinOnly",
        "options"
      ],
      "properties": {
        "maxHintsPerRound": {
          "type": "integer",
          "minimum": 0,
          "maximum": 10
        },
        "coinOnly": {
          "type": "boolean"
        },
        "options": {
          "type": "array",
          "minItems": 1,
          "items": {
            "type": "object",
            "additionalProperties": false,
            "required": [
              "id",
              "coinCost",
              "reveals"
            ],
            "properties": {
              "id": {
                "type": "string",
                "minLength": 1
              },
              "coinCost": {
                "type": "integer",
                "minimum": 0
              },
              "reveals": {
                "type": "object",
                "additionalProperties": false,
                "required": [
                  "firstLetter",
                  "randomLetters",
                  "length"
                ],
                "properties": {
                  "firstLetter": {
                    "type": "boolean"
                  },
                  "randomLetters": {
                    "type": "integer",
                    "minimum": 0,
                    "maximum": 10
                  },
                  "length": {
                    "type": "boolean"
                  }
                }
              }
            }
          }
        }
      }
    }
  }
}
