{
  "dataVersion": "1.1.1",
  "generatedOn": "2026-03-08T00:00:00Z",
  "sourceLexiconVersion": "f0ed269b920a",
  "language": "EN",
  "difficultyBands": [
    {
      "id": "EASY",
      "displayName": "Easy",
      "gradeHint": "Up to Grade 7",
      "rackLetterCount": 7,
      "allowLetterReuseByTimer": {
        "30": false,
        "60": false,
        "90": false
      }
    },
    {
      "id": "MEDIUM",
      "displayName": "Medium",
      "gradeHint": "Grade 10",
      "rackLetterCount": 8,
      "allowLetterReuseByTimer": {
        "30": false,
        "60": false,
        "90": false
      }
    },
    {
      "id": "HARD",
      "displayName": "Hard",
      "gradeHint": "Graduate",
      "rackLetterCount": 10,
      "allowLetterReuseByTimer": {
        "30": false,
        "60": true,
        "90": true
      }
    },
    {
      "id": "PRO",
      "displayName": "Professional",
      "gradeHint": "PhD",
      "rackLetterCount": 12,
      "allowLetterReuseByTimer": {
        "30": true,
        "60": true,
        "90": true
      }
    }
  ],
  "timers": [30, 60, 90],
  "scoring": {
    "completionPercentMode": "FOUND_OVER_TOTAL_POSSIBLE",
    "altCompletionPercentMode": "FOUND_OVER_TARGET",
    "rawScoreEnabled": true,
    "rawScore": {
      "basePerWord": 10,
      "lengthBonus": {
        "3": 0,
        "4": 2,
        "5": 4,
        "6": 6,
        "7": 8,
        "8": 10,
        "9": 12,
        "10": 14,
        "11": 16,
        "12": 18
      },
      "perfectRoundBonus": {
        "type": "PERCENT",
        "value": 5
      }
    },
    "stars": {
      "star1Percent": 50,
      "star2Percent": 75,
      "star3Percent": 90
    },
    "completionModes": [
      {
        "id": "A_TOTAL_POSSIBLE",
        "label": "Found / Total Possible",
        "numerator": "foundWordsCount",
        "denominator": "totalPossibleWordsCount",
        "csvField": "totalPossibleWordsCsv"
      },
      {
        "id": "B_TARGET",
        "label": "Found / Target",
        "numerator": "foundWordsCount",
        "denominator": "targetWordsCount",
        "csvField": "targetWordsCsv",
        "optional": true
      }
    ]
  },
  "hints": {
    "maxHintsPerRound": 3,
    "coinOnly": true,
    "options": [
      {
        "id": "REVEAL_FIRST_AND_LENGTH",
        "coinCost": 30,
        "reveals": {
          "firstLetter": true,
          "randomLetters": 0,
          "length": true
        }
      },
      {
        "id": "REVEAL_RANDOM_AND_LENGTH",
        "coinCost": 20,
        "reveals": {
          "firstLetter": false,
          "randomLetters": 1,
          "length": true
        }
      },
      {
        "id": "REVEAL_TWO_RANDOM_AND_LENGTH",
        "coinCost": 45,
        "reveals": {
          "firstLetter": false,
          "randomLetters": 2,
          "length": true
        }
      }
    ]
  }
}
